{
  "$schema": "https://json-schema.org/draft/2020-12/schema",
  "$id": "https://cloudhal.dev/schemas/v1/asset.schema.json",
  "title": "Asset",
  "description": "A media file of a site (image, video, audio, document, data) as a graph node: its bytes are identified by SHA-256 and stored once per site in the blob store under a content-addressed key, or kept elsewhere (`storage.kind: external`, e.g. a Zenodo or Hugging Face file). Pages, entries and terms refer to it by id (`ImageRef.assetId`, markdown `asset:<id>`). Snapshotted like every node, so a deleted asset's bytes stay while any snapshot references it (RFC-0004).",
  "type": "object",
  "additionalProperties": false,
  "required": [
    "schemaVersion",
    "id",
    "siteId",
    "kind",
    "mediaType",
    "bytes",
    "sha256",
    "slug",
    "storage",
    "status",
    "uploadedBy",
    "source",
    "rev",
    "createdAt",
    "updatedAt"
  ],
  "properties": {
    "schemaVersion": { "$ref": "common.schema.json#/$defs/SchemaVersion" },
    "id": { "$ref": "common.schema.json#/$defs/Id" },
    "siteId": { "$ref": "common.schema.json#/$defs/Id" },
    "kind": {
      "type": "string",
      "description": "What the file is, derived from the sniffed media type (never chosen by the client). `other` is allowed for external storage only.",
      "enum": ["image", "video", "audio", "document", "data", "other"]
    },
    "mediaType": {
      "type": "string",
      "description": "MIME type of the stored bytes as sniffed by the server (RFC 6838, lower case, no parameters), e.g. image/webp, text/csv. Served as Content-Type.",
      "pattern": "^[a-z0-9][a-z0-9!#$&^_.+-]{0,126}/[a-z0-9][a-z0-9!#$&^_.+-]{0,126}$",
      "maxLength": 255
    },
    "bytes": {
      "type": "integer",
      "description": "Size of the stored bytes. For external files: the size the source reports or the uploader declares.",
      "minimum": 0
    },
    "sha256": {
      "$ref": "#/$defs/Sha256",
      "description": "SHA-256 of the stored bytes (lower-case hex): the blob key, the public URL prefix, the ETag and the checksum shown with downloads. Unique per site. For external files see `storage.checksum`."
    },
    "originalSha256": {
      "$ref": "#/$defs/Sha256",
      "description": "SHA-256 of the bytes as uploaded, present only when the server changed them (image metadata stripping)."
    },
    "slug": {
      "$ref": "common.schema.json#/$defs/Slug",
      "description": "File name in the public URL, without extension: /media/<sha256[0..16]>/<slug>.<ext>. May change; the old URL then answers 301 to the new one."
    },
    "storage": { "$ref": "#/$defs/AssetStorage" },
    "image": { "$ref": "#/$defs/AssetImage" },
    "title": {
      "type": "object",
      "description": "Display title per locale (download lists, library search).",
      "propertyNames": { "$ref": "common.schema.json#/$defs/Locale" },
      "minProperties": 1,
      "additionalProperties": { "type": "string", "minLength": 1, "maxLength": 300 }
    },
    "alt": {
      "type": "object",
      "description": "Alternative text per locale. An `ImageRef.alt` that is not empty overrides it for one use.",
      "propertyNames": { "$ref": "common.schema.json#/$defs/Locale" },
      "minProperties": 1,
      "additionalProperties": { "type": "string", "minLength": 1, "maxLength": 500 }
    },
    "decorative": {
      "type": "boolean",
      "description": "The image carries no information and renders with alt=\"\". Absent means false; the store never writes false."
    },
    "caption": {
      "type": "object",
      "description": "Caption per locale (plain text), the default for figures that show this asset.",
      "propertyNames": { "$ref": "common.schema.json#/$defs/Locale" },
      "minProperties": 1,
      "additionalProperties": { "type": "string", "minLength": 1, "maxLength": 1000 }
    },
    "credit": {
      "type": "string",
      "description": "Who made it, as shown next to it (e.g. 'Photo: Ayşe Yılmaz').",
      "minLength": 1,
      "maxLength": 300
    },
    "license": { "$ref": "#/$defs/AssetLicense" },
    "status": {
      "type": "string",
      "description": "active: listed and pickable. retired: hidden from the library and pickers and cannot be newly referenced; existing references keep rendering.",
      "enum": ["active", "retired"]
    },
    "uploadedBy": { "$ref": "common.schema.json#/$defs/Actor" },
    "source": { "$ref": "#/$defs/AssetSource" },
    "rev": { "$ref": "common.schema.json#/$defs/Revision" },
    "createdAt": { "$ref": "common.schema.json#/$defs/Timestamp" },
    "updatedAt": { "$ref": "common.schema.json#/$defs/Timestamp" },
    "metadata": { "$ref": "common.schema.json#/$defs/Metadata" }
  },
  "$defs": {
    "Sha256": {
      "type": "string",
      "description": "Lower-case hex SHA-256 digest.",
      "pattern": "^[0-9a-f]{64}$"
    },
    "HttpsUrl": {
      "type": "string",
      "description": "Absolute https URL without credentials, whitespace or backslashes.",
      "pattern": "^https://[^\\s\\\\/?#@]+(?:[/?#][^\\s\\\\]*)?$",
      "maxLength": 2048
    },
    "AssetStorage": {
      "description": "Where the bytes live. `blob`: in this deployment's blob store (R2 or the filesystem) under the content-addressed key media/<siteId>/<sha256>, derived and never stored, so the node is portable between backends. `external`: elsewhere, linked rather than hosted (large research files on Zenodo or Hugging Face).",
      "oneOf": [
        {
          "type": "object",
          "title": "BlobStorage",
          "additionalProperties": false,
          "required": ["kind"],
          "properties": {
            "kind": { "type": "string", "enum": ["blob"] }
          }
        },
        {
          "type": "object",
          "title": "ExternalStorage",
          "additionalProperties": false,
          "required": ["kind", "url", "checksum"],
          "properties": {
            "kind": { "type": "string", "enum": ["external"] },
            "url": {
              "$ref": "#/$defs/HttpsUrl",
              "description": "Direct download URL of the file."
            },
            "landingPage": {
              "$ref": "#/$defs/HttpsUrl",
              "description": "Human page of the record the file belongs to (e.g. a Zenodo record or a Hugging Face dataset)."
            },
            "checksum": {
              "type": "string",
              "description": "How `sha256` was obtained. computed: the server or `cloudhal media verify` streamed the URL and hashed it. declared: given by the person who linked it, not verified (shown as such).",
              "enum": ["computed", "declared"]
            },
            "verifiedAt": {
              "$ref": "common.schema.json#/$defs/Timestamp",
              "description": "When the URL last produced bytes with this SHA-256 (checksum `computed`)."
            }
          }
        }
      ]
    },
    "AssetImage": {
      "type": "object",
      "description": "Intrinsic size and placeholders of an image. Present for every image stored as a blob.",
      "additionalProperties": false,
      "required": ["width", "height"],
      "properties": {
        "width": { "type": "integer", "minimum": 1, "maximum": 100000 },
        "height": { "type": "integer", "minimum": 1, "maximum": 100000 },
        "animated": {
          "type": "boolean",
          "description": "Animated GIF or WebP: never resized or re-encoded. Absent means false; the store never writes false."
        },
        "blurhash": {
          "type": "string",
          "description": "BlurHash of the image for themes that decode it client-side.",
          "pattern": "^[0-9A-Za-z#$%*+,.:;=?@^_{|}~\\[\\]-]{6,100}$"
        },
        "lqip": {
          "type": "string",
          "description": "Low-quality placeholder: a raster data: URL of at most about 3 KB, shown while the image loads.",
          "pattern": "^data:image/(?:webp|png|jpeg);base64,[A-Za-z0-9+/]+={0,2}$",
          "maxLength": 4096
        }
      }
    },
    "AssetLicense": {
      "description": "Terms the asset may be reused under: an SPDX license expression or a license URL.",
      "oneOf": [
        {
          "type": "object",
          "title": "SpdxLicense",
          "additionalProperties": false,
          "required": ["kind", "id"],
          "properties": {
            "kind": { "type": "string", "enum": ["spdx"] },
            "id": {
              "type": "string",
              "description": "SPDX license identifier or simple expression, e.g. CC-BY-4.0, CC0-1.0, MIT OR Apache-2.0, LicenseRef-AllRightsReserved.",
              "pattern": "^[A-Za-z0-9][A-Za-z0-9.+-]*(?: (?:AND|OR|WITH) [A-Za-z0-9][A-Za-z0-9.+-]*)*$",
              "maxLength": 200
            }
          }
        },
        {
          "type": "object",
          "title": "UrlLicense",
          "additionalProperties": false,
          "required": ["kind", "url"],
          "properties": {
            "kind": { "type": "string", "enum": ["url"] },
            "url": { "$ref": "#/$defs/HttpsUrl" },
            "name": { "type": "string", "minLength": 1, "maxLength": 200 }
          }
        }
      ]
    },
    "AssetSource": {
      "description": "How the asset came in. Immutable after create.",
      "oneOf": [
        {
          "type": "object",
          "title": "UploadSource",
          "description": "Bytes uploaded by a person (REST) or an agent (MCP upload_asset).",
          "additionalProperties": false,
          "required": ["kind"],
          "properties": {
            "kind": { "type": "string", "enum": ["upload"] },
            "filename": {
              "type": "string",
              "description": "Original file name as sent (never used as a storage key or served).",
              "pattern": "^[^/\\\\\\u0000-\\u001f\\u007f]+$",
              "minLength": 1,
              "maxLength": 255
            }
          }
        },
        {
          "type": "object",
          "title": "FetchSource",
          "description": "Bytes the server fetched from an https URL (MCP fetch_asset_url, Studio 'From URL') under the SSRF rules.",
          "additionalProperties": false,
          "required": ["kind", "url", "fetchedAt"],
          "properties": {
            "kind": { "type": "string", "enum": ["fetch"] },
            "url": { "$ref": "#/$defs/HttpsUrl" },
            "fetchedAt": { "$ref": "common.schema.json#/$defs/Timestamp" }
          }
        },
        {
          "type": "object",
          "title": "ImportSource",
          "description": "Created by a migration or importer (e.g. `cloudhal media import-urls` from an ImageRef.src).",
          "additionalProperties": false,
          "required": ["kind", "from"],
          "properties": {
            "kind": { "type": "string", "enum": ["import"] },
            "from": {
              "type": "string",
              "description": "The reference it was imported from: a URL or a site path.",
              "minLength": 1,
              "maxLength": 2048
            },
            "importer": { "$ref": "common.schema.json#/$defs/Slug" }
          }
        },
        {
          "type": "object",
          "title": "LinkSource",
          "description": "An external file registered by URL without copying its bytes (storage.kind external).",
          "additionalProperties": false,
          "required": ["kind"],
          "properties": {
            "kind": { "type": "string", "enum": ["link"] }
          }
        }
      ]
    }
  }
}
