{
  "schemaVersion": 1,
  "id": "asset_01HZX8K3Q9PD",
  "siteId": "site_01HZX8K3Q9EF",
  "kind": "document",
  "mediaType": "application/pdf",
  "bytes": 1048576,
  "sha256": "0a1b2c3d4e5f60718293a4b5c6d7e8f90a1b2c3d4e5f60718293a4b5c6d7e8f9",
  "slug": "annual-report-2025",
  "storage": {
    "kind": "blob"
  },
  "title": {
    "en": "Annual report 2025"
  },
  "license": {
    "kind": "spdx",
    "id": "LicenseRef-AllRightsReserved"
  },
  "status": "retired",
  "uploadedBy": {
    "kind": "system",
    "id": "sys_01HZX8K3Q9MG",
    "name": "cloudhal media import-urls"
  },
  "source": {
    "kind": "import",
    "from": "https://old.example.com/files/annual-report-2025.pdf",
    "importer": "import-urls"
  },
  "rev": 3,
  "createdAt": "2026-10-08T08:00:00Z",
  "updatedAt": "2026-10-08T13:00:00Z"
}
