{
  "schemaVersion": 1,
  "id": "asset_01HZX8K3Q9DS",
  "siteId": "site_01HZX8K3Q9EF",
  "kind": "data",
  "mediaType": "text/csv",
  "bytes": 7340032000,
  "sha256": "5e7d9f1b3a5c7e9d1f3b5a7c9e1d3f5b7a9c1e3d5f7b9a1c3e5d7f9b1a3c5e7d",
  "slug": "istanbul-air-quality-2025",
  "storage": {
    "kind": "external",
    "url": "https://zenodo.org/records/1234567/files/istanbul-air-quality-2025.csv?download=1",
    "landingPage": "https://zenodo.org/records/1234567",
    "checksum": "declared"
  },
  "title": {
    "en": "Istanbul air quality, hourly, 2025"
  },
  "license": {
    "kind": "spdx",
    "id": "CC-BY-4.0"
  },
  "status": "active",
  "uploadedBy": {
    "kind": "human",
    "id": "user_01HZX8K3Q9HU",
    "name": "Halil"
  },
  "source": {
    "kind": "link"
  },
  "rev": 0,
  "createdAt": "2026-10-08T11:00:00Z",
  "updatedAt": "2026-10-08T11:00:00Z"
}
